{
  "assemblyProfile": {
    "componentSelection": "full-focus-primary-echo",
    "exposurePolicy": "protected-centroid-occlusion-v1",
    "placement": "compact-overlap",
    "profileVersion": "1.0.0"
  },
  "canonicalBounds": {
    "max": [
      1.2917184608331138,
      1.2778308858400511,
      0.521413345389891
    ],
    "min": [
      -1.673019606010285,
      -1.871469630411743,
      -0.8965756012879877
    ],
    "size": [
      2.964738066843399,
      3.1493005162517944,
      1.4179889466778788
    ]
  },
  "canonicalCoordinateSystem": {
    "forwardAxis": "+X",
    "handedness": "right",
    "originPolicy": "canonicalBoundsCenter",
    "rightAxis": "-Y",
    "units": "photonic-skin authoring units (V0 sphere radius = 1.0)",
    "upAxis": "+Z"
  },
  "canonicalTransform": {
    "rotateEulerDegrees": [
      0.0,
      0.0,
      0.0
    ],
    "scale": 1.0,
    "translate": [
      0.0,
      0.0,
      0.0
    ]
  },
  "competencyIds": [
    "content",
    "design"
  ],
  "componentSelections": [
    {
      "assemblyRole": "primary",
      "canonicalTransform": {
        "rotateEulerDegrees": [
          0.0,
          0.0,
          0.0
        ],
        "scale": 0.8041451517178116,
        "translate": [
          0.0,
          0.0,
          0.0
        ]
      },
      "componentId": "book-body",
      "connectivityIntent": "fuse",
      "featureRetentionPolicy": {
        "minimumLodQuota": 16,
        "protected": true
      },
      "massWeight": 0.52,
      "minimumMassWeight": 0.03889380417022832,
      "mobilePolicy": {
        "eligible": true,
        "minimumLod": 512
      },
      "parentAssemblyNode": "source-0-shell-0",
      "semanticRole": "primary",
      "silhouetteRetentionPolicy": {
        "minimumLodQuota": 16,
        "protected": true
      },
      "surfaceImportance": 1.35,
      "targetId": "content-open-book",
      "targetVersion": "1.0.0",
      "transitionAnchors": [
        {
          "anchorId": "primary-axis",
          "direction": [
            0.0,
            1.0,
            0.0
          ],
          "kind": "primaryAxis",
          "notes": "Spine direction is the lead axis of the form.",
          "point": [
            0.0,
            0.0,
            0.0
          ]
        },
        {
          "anchorId": "spine-protected",
          "kind": "protectedZone",
          "notes": "The hinge must stay solid: it carries the whole read of the form.",
          "region": {
            "params": {
              "a": [
                0.0,
                -0.86,
                -0.05
              ],
              "b": [
                0.0,
                0.86,
                -0.05
              ],
              "radius": 0.26
            },
            "provider": "capsule"
          }
        },
        {
          "anchorId": "spine-transport",
          "kind": "transportZone",
          "region": {
            "params": {
              "a": [
                0.0,
                -0.8,
                -0.05
              ],
              "b": [
                0.0,
                0.8,
                -0.05
              ],
              "radius": 0.16
            },
            "provider": "capsule"
          }
        }
      ]
    },
    {
      "assemblyRole": "echo",
      "canonicalTransform": {
        "rotateEulerDegrees": [
          0.0,
          0.0,
          294.0642273954946
        ],
        "scale": 0.8321221239013767,
        "translate": [
          -0.48393713836552343,
          -0.2161130401215721,
          -0.04982893105904445
        ]
      },
      "componentId": "palette-board",
      "connectivityIntent": "fuse",
      "featureRetentionPolicy": {
        "minimumLodQuota": 16,
        "protected": true
      },
      "massWeight": 0.4799999999999999,
      "minimumMassWeight": 0.4799999999999999,
      "mobilePolicy": {
        "eligible": false,
        "minimumLod": 512
      },
      "parentAssemblyNode": "source-1-shell-16",
      "semanticRole": "primary",
      "silhouetteRetentionPolicy": {
        "minimumLodQuota": 16,
        "protected": true
      },
      "surfaceImportance": 1.0,
      "targetId": "design-palette-brushes",
      "targetVersion": "1.0.0",
      "transitionAnchors": [
        {
          "anchorId": "primary-axis",
          "direction": [
            1.0,
            0.0,
            0.0
          ],
          "kind": "primaryAxis",
          "point": [
            0.0,
            0.0,
            0.0
          ]
        },
        {
          "anchorId": "hole-protected",
          "kind": "protectedZone",
          "notes": "A compiler must not close the hole while the board still reads as a palette.",
          "region": {
            "params": {
              "a": [
                0.6,
                -0.28,
                -0.6
              ],
              "b": [
                0.6,
                -0.28,
                0.6
              ],
              "radius": 0.3
            },
            "provider": "capsule"
          }
        },
        {
          "anchorId": "toward-brushes",
          "kind": "bridgeZone",
          "point": [
            -0.2,
            0.52,
            0.16
          ],
          "radius": 0.26
        }
      ]
    }
  ],
  "compositionMode": "FOCUS",
  "displayName": "Complex Focus Content Design Focus Content",
  "focusCompetencyId": "content",
  "identityPolicy": {
    "mapping": "canonical-master-stratified",
    "size": 16384,
    "spaceVersion": "ps03m3-identity-v1"
  },
  "lodPolicy": {
    "levels": [
      512,
      1024,
      2048,
      4096,
      8192,
      12288,
      16384
    ],
    "nested": true,
    "priority": "protected-zones-weighted-round-robin"
  },
  "normalizationPolicy": {
    "mode": "preserve-v0",
    "targetVolume": 4.185075142010032,
    "tolerance": 0.01
  },
  "provenance": {
    "approvalStatus": "requires-human-approval",
    "builder": "ps03m3-builder-v1",
    "sourceDefinitionHashes": {
      "content-open-book": "5f19dc0562c2845b9864e862a7a8482309bd95c0b7169d63f0442b3c991af6e9",
      "design-palette-brushes": "d16425cb8c109ae13777bd6464df11a3012fc0fb9121fd1b6c3f157d805a33db"
    },
    "stage": "PS-03.M3"
  },
  "reservePolicy": {
    "depthRange": [
      0.16,
      0.32
    ],
    "emergenceOrder": "lod-priority",
    "mode": "canonical-subsurface-pack"
  },
  "schemaVersion": "1.0.0",
  "sourceTargets": [
    {
      "definitionHash": "5f19dc0562c2845b9864e862a7a8482309bd95c0b7169d63f0442b3c991af6e9",
      "targetId": "content-open-book",
      "targetVersion": "1.0.0"
    },
    {
      "definitionHash": "d16425cb8c109ae13777bd6464df11a3012fc0fb9121fd1b6c3f157d805a33db",
      "targetId": "design-palette-brushes",
      "targetVersion": "1.0.0"
    }
  ],
  "stateId": "complex-focus-content-design-focus-content",
  "stateRole": "complex",
  "stateVersion": "1.0.0",
  "surfaceEnvelopePolicy": {
    "contactCull": true,
    "maximumAreaRatio": 2.645,
    "preferredAreaRatio": 2.6
  },
  "transitionAffordances": {
    "allowedInternalTransport": true,
    "inheritTargetAnchors": true,
    "primaryAxis": [
      1.0,
      0.0,
      0.0
    ]
  },
  "validationPolicy": {
    "allowDeclaredFusionOverlap": true,
    "surfaceEnvelope": 2.645,
    "volumeTolerance": 0.01
  }
}
