{
  "assemblyProfile": {
    "componentSelection": "full-focus-primary-echo",
    "exposurePolicy": "protected-centroid-occlusion-v1",
    "placement": "compact-overlap",
    "profileVersion": "1.0.0"
  },
  "canonicalBounds": {
    "max": [
      0.5360164643776926,
      1.2057011825377275,
      0.5645941209183064
    ],
    "min": [
      -2.393144118148319,
      -2.659040817493309,
      -1.0979611035339563
    ],
    "size": [
      2.929160582526012,
      3.8647420000310366,
      1.6625552244522628
    ]
  },
  "canonicalCoordinateSystem": {
    "forwardAxis": "+X",
    "handedness": "right",
    "originPolicy": "canonicalBoundsCenter",
    "rightAxis": "-Y",
    "units": "photonic-skin authoring units (V0 sphere radius = 1.0)",
    "upAxis": "+Z"
  },
  "canonicalTransform": {
    "rotateEulerDegrees": [
      0.0,
      0.0,
      0.0
    ],
    "scale": 1.0,
    "translate": [
      0.0,
      0.0,
      0.0
    ]
  },
  "competencyIds": [
    "digital",
    "video"
  ],
  "componentSelections": [
    {
      "assemblyRole": "primary",
      "canonicalTransform": {
        "rotateEulerDegrees": [
          0.0,
          0.0,
          0.0
        ],
        "scale": 0.9892851607680984,
        "translate": [
          0.0,
          0.0,
          0.0
        ]
      },
      "componentId": "laptop-base",
      "connectivityIntent": "fuse",
      "featureRetentionPolicy": {
        "minimumLodQuota": 16,
        "protected": true
      },
      "massWeight": 0.52,
      "minimumMassWeight": 0.38,
      "mobilePolicy": {
        "eligible": true,
        "minimumLod": 512
      },
      "parentAssemblyNode": "source-0-shell-0",
      "semanticRole": "primary",
      "silhouetteRetentionPolicy": {
        "minimumLodQuota": 16,
        "protected": true
      },
      "surfaceImportance": 1.35,
      "targetId": "digital-laptop-phone",
      "targetVersion": "1.0.0",
      "transitionAnchors": [
        {
          "anchorId": "primary-axis",
          "direction": [
            0.0,
            1.0,
            0.0
          ],
          "kind": "primaryAxis",
          "point": [
            0.0,
            0.0,
            0.0
          ]
        },
        {
          "anchorId": "hinge-protected",
          "kind": "protectedZone",
          "notes": "The hinge line carries the whole open-laptop read.",
          "region": {
            "params": {
              "a": [
                -0.74,
                0.55,
                0.09
              ],
              "b": [
                0.74,
                0.55,
                0.09
              ],
              "radius": 0.18
            },
            "provider": "capsule"
          }
        },
        {
          "anchorId": "toward-phone",
          "kind": "bridgeZone",
          "point": [
            0.8,
            -0.16,
            0.0
          ],
          "radius": 0.24
        }
      ]
    },
    {
      "assemblyRole": "echo",
      "canonicalTransform": {
        "rotateEulerDegrees": [
          0.0,
          0.0,
          294.0642273954946
        ],
        "scale": 0.8869832469490896,
        "translate": [
          -0.48393713836552343,
          -0.2161130401215721,
          -0.04982893105904445
        ]
      },
      "componentId": "camera",
      "connectivityIntent": "fuse",
      "featureRetentionPolicy": {
        "minimumLodQuota": 16,
        "protected": true
      },
      "massWeight": 0.48000000000000004,
      "minimumMassWeight": 0.48000000000000004,
      "mobilePolicy": {
        "eligible": false,
        "minimumLod": 512
      },
      "parentAssemblyNode": "source-1-shell-16",
      "semanticRole": "primary",
      "silhouetteRetentionPolicy": {
        "minimumLodQuota": 16,
        "protected": true
      },
      "surfaceImportance": 1.0,
      "targetId": "video-camera-clapperboard",
      "targetVersion": "1.0.0",
      "transitionAnchors": [
        {
          "anchorId": "primary-axis",
          "direction": [
            1.0,
            0.0,
            0.0
          ],
          "kind": "primaryAxis",
          "point": [
            0.0,
            0.0,
            0.0
          ]
        },
        {
          "anchorId": "lens-protected",
          "kind": "protectedZone",
          "region": {
            "params": {
              "a": [
                0.46,
                0.0,
                0.03
              ],
              "b": [
                0.9,
                0.0,
                0.03
              ],
              "radius": 0.28
            },
            "provider": "capsule"
          }
        },
        {
          "anchorId": "toward-slate",
          "kind": "bridgeZone",
          "point": [
            0.3,
            -0.34,
            -0.24
          ],
          "radius": 0.26
        }
      ]
    }
  ],
  "compositionMode": "FOCUS",
  "displayName": "Complex Focus Digital Video Focus Digital",
  "focusCompetencyId": "digital",
  "identityPolicy": {
    "mapping": "canonical-master-stratified",
    "size": 16384,
    "spaceVersion": "ps03m3-identity-v1"
  },
  "lodPolicy": {
    "levels": [
      512,
      1024,
      2048,
      4096,
      8192,
      12288,
      16384
    ],
    "nested": true,
    "priority": "protected-zones-weighted-round-robin"
  },
  "normalizationPolicy": {
    "mode": "preserve-v0",
    "targetVolume": 4.185075142010032,
    "tolerance": 0.01
  },
  "provenance": {
    "approvalStatus": "requires-human-approval",
    "builder": "ps03m3-builder-v1",
    "sourceDefinitionHashes": {
      "digital-laptop-phone": "0340464f4076842396fbf90619a94a2402f7a4480b1c640be54efa1c43bc92c1",
      "video-camera-clapperboard": "435b9d3030fff9f6a2c65ec3b2eb7cee570966873f85bab0f83940732045c762"
    },
    "stage": "PS-03.M3"
  },
  "reservePolicy": {
    "depthRange": [
      0.16,
      0.32
    ],
    "emergenceOrder": "lod-priority",
    "mode": "canonical-subsurface-pack"
  },
  "schemaVersion": "1.0.0",
  "sourceTargets": [
    {
      "definitionHash": "0340464f4076842396fbf90619a94a2402f7a4480b1c640be54efa1c43bc92c1",
      "targetId": "digital-laptop-phone",
      "targetVersion": "1.0.0"
    },
    {
      "definitionHash": "435b9d3030fff9f6a2c65ec3b2eb7cee570966873f85bab0f83940732045c762",
      "targetId": "video-camera-clapperboard",
      "targetVersion": "1.0.0"
    }
  ],
  "stateId": "complex-focus-digital-video-focus-digital",
  "stateRole": "complex",
  "stateVersion": "1.0.0",
  "surfaceEnvelopePolicy": {
    "contactCull": true,
    "maximumAreaRatio": 2.645,
    "preferredAreaRatio": 2.6
  },
  "transitionAffordances": {
    "allowedInternalTransport": true,
    "inheritTargetAnchors": true,
    "primaryAxis": [
      1.0,
      0.0,
      0.0
    ]
  },
  "validationPolicy": {
    "allowDeclaredFusionOverlap": true,
    "surfaceEnvelope": 2.645,
    "volumeTolerance": 0.01
  }
}
