{
  "assemblyProfile": {
    "componentSelection": "full-focus-primary-echo",
    "exposurePolicy": "protected-centroid-occlusion-v1",
    "placement": "source-preserving",
    "profileVersion": "1.0.0"
  },
  "canonicalBounds": {
    "max": [
      1.873252,
      1.293676,
      1.017575
    ],
    "min": [
      -1.873252,
      -1.293676,
      -1.017575
    ],
    "size": [
      3.746504,
      2.587352,
      2.03515
    ]
  },
  "canonicalCoordinateSystem": {
    "forwardAxis": "+X",
    "handedness": "right",
    "originPolicy": "canonicalBoundsCenter",
    "rightAxis": "-Y",
    "units": "photonic-skin authoring units (V0 sphere radius = 1.0)",
    "upAxis": "+Z"
  },
  "canonicalTransform": {
    "rotateEulerDegrees": [
      0.0,
      0.0,
      0.0
    ],
    "scale": 1.0,
    "translate": [
      0.0,
      0.0,
      0.0
    ]
  },
  "competencyIds": [
    "design"
  ],
  "componentSelections": [
    {
      "assemblyRole": "primary",
      "canonicalTransform": {
        "rotateEulerDegrees": [
          0.0,
          0.0,
          0.0
        ],
        "scale": 1.0,
        "translate": [
          0.0,
          0.0,
          0.0
        ]
      },
      "componentId": "palette-board",
      "connectivityIntent": "preserve",
      "featureRetentionPolicy": {
        "minimumLodQuota": 16,
        "protected": true
      },
      "massWeight": 0.8330671907628056,
      "minimumMassWeight": 0.6,
      "mobilePolicy": {
        "eligible": true,
        "minimumLod": 512
      },
      "parentAssemblyNode": "source-0-shell-0",
      "semanticRole": "primary",
      "silhouetteRetentionPolicy": {
        "minimumLodQuota": 16,
        "protected": true
      },
      "surfaceImportance": 1.35,
      "targetId": "design-palette-brushes",
      "targetVersion": "1.0.0",
      "transitionAnchors": [
        {
          "anchorId": "primary-axis",
          "direction": [
            1.0,
            0.0,
            0.0
          ],
          "kind": "primaryAxis",
          "point": [
            0.0,
            0.0,
            0.0
          ]
        },
        {
          "anchorId": "hole-protected",
          "kind": "protectedZone",
          "notes": "A compiler must not close the hole while the board still reads as a palette.",
          "region": {
            "params": {
              "a": [
                0.6,
                -0.28,
                -0.6
              ],
              "b": [
                0.6,
                -0.28,
                0.6
              ],
              "radius": 0.3
            },
            "provider": "capsule"
          }
        },
        {
          "anchorId": "toward-brushes",
          "kind": "bridgeZone",
          "point": [
            -0.2,
            0.52,
            0.16
          ],
          "radius": 0.26
        }
      ]
    },
    {
      "assemblyRole": "primary",
      "canonicalTransform": {
        "rotateEulerDegrees": [
          0.0,
          0.0,
          0.0
        ],
        "scale": 1.0,
        "translate": [
          0.0,
          0.0,
          0.0
        ]
      },
      "componentId": "brush-upper",
      "connectivityIntent": "preserve",
      "featureRetentionPolicy": {
        "minimumLodQuota": 16,
        "protected": true
      },
      "massWeight": 0.09360029480407812,
      "minimumMassWeight": 0.05,
      "mobilePolicy": {
        "eligible": true,
        "minimumLod": 512
      },
      "parentAssemblyNode": "source-0-shell-1",
      "semanticRole": "secondary",
      "silhouetteRetentionPolicy": {
        "minimumLodQuota": 16,
        "protected": true
      },
      "surfaceImportance": 1.35,
      "targetId": "design-palette-brushes",
      "targetVersion": "1.0.0",
      "transitionAnchors": [
        {
          "anchorId": "primary-axis",
          "direction": [
            1.0,
            0.0,
            0.0
          ],
          "kind": "primaryAxis",
          "point": [
            0.0,
            0.0,
            0.0
          ]
        },
        {
          "anchorId": "handle-neck",
          "direction": [
            1.0,
            0.0,
            0.0
          ],
          "kind": "splitNeck",
          "point": [
            -0.3,
            0.0,
            0.0
          ],
          "radius": 0.12
        },
        {
          "anchorId": "toward-board",
          "kind": "bridgeZone",
          "point": [
            -0.1,
            -0.3,
            -0.32
          ],
          "radius": 0.24
        }
      ]
    },
    {
      "assemblyRole": "primary",
      "canonicalTransform": {
        "rotateEulerDegrees": [
          0.0,
          0.0,
          0.0
        ],
        "scale": 1.0,
        "translate": [
          0.0,
          0.0,
          0.0
        ]
      },
      "componentId": "brush-lower",
      "connectivityIntent": "preserve",
      "featureRetentionPolicy": {
        "minimumLodQuota": 16,
        "protected": true
      },
      "massWeight": 0.07333251443311632,
      "minimumMassWeight": 0.04,
      "mobilePolicy": {
        "eligible": true,
        "minimumLod": 512
      },
      "parentAssemblyNode": "source-0-shell-2",
      "semanticRole": "secondary",
      "silhouetteRetentionPolicy": {
        "minimumLodQuota": 16,
        "protected": true
      },
      "surfaceImportance": 1.35,
      "targetId": "design-palette-brushes",
      "targetVersion": "1.0.0",
      "transitionAnchors": [
        {
          "anchorId": "primary-axis",
          "direction": [
            1.0,
            0.0,
            0.0
          ],
          "kind": "primaryAxis",
          "point": [
            0.0,
            0.0,
            0.0
          ]
        },
        {
          "anchorId": "handle-neck",
          "direction": [
            1.0,
            0.0,
            0.0
          ],
          "kind": "splitNeck",
          "point": [
            -0.3,
            0.0,
            0.0
          ],
          "radius": 0.12
        },
        {
          "anchorId": "toward-board",
          "kind": "bridgeZone",
          "point": [
            -0.1,
            -0.24,
            -0.1
          ],
          "radius": 0.24
        }
      ]
    }
  ],
  "compositionMode": "SINGLE",
  "displayName": "Single Design",
  "focusCompetencyId": "design",
  "identityPolicy": {
    "mapping": "canonical-master-stratified",
    "size": 16384,
    "spaceVersion": "ps03m3-identity-v1"
  },
  "lodPolicy": {
    "levels": [
      512,
      1024,
      2048,
      4096,
      8192,
      12288,
      16384
    ],
    "nested": true,
    "priority": "protected-zones-weighted-round-robin"
  },
  "normalizationPolicy": {
    "mode": "preserve-v0",
    "targetVolume": 4.185075142010032,
    "tolerance": 0.01
  },
  "provenance": {
    "approvalStatus": "human-approved-source",
    "builder": "ps03m3-builder-v1",
    "sourceDefinitionHashes": {
      "design-palette-brushes": "d16425cb8c109ae13777bd6464df11a3012fc0fb9121fd1b6c3f157d805a33db"
    },
    "stage": "PS-03.M3"
  },
  "reservePolicy": {
    "depthRange": [
      0.16,
      0.32
    ],
    "emergenceOrder": "lod-priority",
    "mode": "canonical-subsurface-pack"
  },
  "schemaVersion": "1.0.0",
  "sourceTargets": [
    {
      "definitionHash": "d16425cb8c109ae13777bd6464df11a3012fc0fb9121fd1b6c3f157d805a33db",
      "targetId": "design-palette-brushes",
      "targetVersion": "1.0.0"
    }
  ],
  "stateId": "single-design",
  "stateRole": "single",
  "stateVersion": "1.0.0",
  "surfaceEnvelopePolicy": {
    "contactCull": false,
    "maximumAreaRatio": 2.645,
    "preferredAreaRatio": 2.6
  },
  "transitionAffordances": {
    "allowedInternalTransport": true,
    "inheritTargetAnchors": true,
    "primaryAxis": [
      1.0,
      0.0,
      0.0
    ]
  },
  "validationPolicy": {
    "allowDeclaredFusionOverlap": false,
    "surfaceEnvelope": 2.645,
    "volumeTolerance": 0.01
  }
}
