{
  "assemblyProfile": {
    "componentSelection": "full-focus-primary-echo",
    "exposurePolicy": "protected-centroid-occlusion-v1",
    "placement": "source-preserving",
    "profileVersion": "1.0.0"
  },
  "canonicalBounds": {
    "max": [
      2.608015,
      2.529459,
      0.773588
    ],
    "min": [
      -2.608015,
      -2.529459,
      -0.773588
    ],
    "size": [
      5.21603,
      5.058918,
      1.547176
    ]
  },
  "canonicalCoordinateSystem": {
    "forwardAxis": "+X",
    "handedness": "right",
    "originPolicy": "canonicalBoundsCenter",
    "rightAxis": "-Y",
    "units": "photonic-skin authoring units (V0 sphere radius = 1.0)",
    "upAxis": "+Z"
  },
  "canonicalTransform": {
    "rotateEulerDegrees": [
      0.0,
      0.0,
      0.0
    ],
    "scale": 1.0,
    "translate": [
      0.0,
      0.0,
      0.0
    ]
  },
  "competencyIds": [
    "merch"
  ],
  "componentSelections": [
    {
      "assemblyRole": "primary",
      "canonicalTransform": {
        "rotateEulerDegrees": [
          0.0,
          0.0,
          0.0
        ],
        "scale": 1.0,
        "translate": [
          0.0,
          0.0,
          0.0
        ]
      },
      "componentId": "tee",
      "connectivityIntent": "preserve",
      "featureRetentionPolicy": {
        "minimumLodQuota": 16,
        "protected": true
      },
      "massWeight": 0.41836734693877553,
      "minimumMassWeight": 0.28,
      "mobilePolicy": {
        "eligible": true,
        "minimumLod": 512
      },
      "parentAssemblyNode": "source-0-shell-0",
      "semanticRole": "primary",
      "silhouetteRetentionPolicy": {
        "minimumLodQuota": 16,
        "protected": true
      },
      "surfaceImportance": 1.35,
      "targetId": "merch-tee-thermos-box",
      "targetVersion": "1.0.0",
      "transitionAnchors": [
        {
          "anchorId": "primary-axis",
          "direction": [
            0.0,
            1.0,
            0.0
          ],
          "kind": "primaryAxis",
          "point": [
            0.0,
            0.0,
            0.0
          ]
        },
        {
          "anchorId": "toward-thermos",
          "kind": "bridgeZone",
          "point": [
            0.44,
            0.34,
            0.0
          ],
          "radius": 0.24
        }
      ]
    },
    {
      "assemblyRole": "primary",
      "canonicalTransform": {
        "rotateEulerDegrees": [
          0.0,
          0.0,
          0.0
        ],
        "scale": 1.0,
        "translate": [
          0.0,
          0.0,
          0.0
        ]
      },
      "componentId": "thermos",
      "connectivityIntent": "preserve",
      "featureRetentionPolicy": {
        "minimumLodQuota": 16,
        "protected": true
      },
      "massWeight": 0.13078717201166182,
      "minimumMassWeight": 0.08,
      "mobilePolicy": {
        "eligible": true,
        "minimumLod": 512
      },
      "parentAssemblyNode": "source-0-shell-1",
      "semanticRole": "secondary",
      "silhouetteRetentionPolicy": {
        "minimumLodQuota": 16,
        "protected": true
      },
      "surfaceImportance": 1.35,
      "targetId": "merch-tee-thermos-box",
      "targetVersion": "1.0.0",
      "transitionAnchors": [
        {
          "anchorId": "primary-axis",
          "direction": [
            0.0,
            0.0,
            1.0
          ],
          "kind": "primaryAxis",
          "point": [
            0.0,
            0.0,
            0.0
          ]
        },
        {
          "anchorId": "toward-box",
          "kind": "bridgeZone",
          "point": [
            0.14,
            -0.2,
            -0.3
          ],
          "radius": 0.22
        }
      ]
    },
    {
      "assemblyRole": "primary",
      "canonicalTransform": {
        "rotateEulerDegrees": [
          0.0,
          0.0,
          0.0
        ],
        "scale": 1.0,
        "translate": [
          0.0,
          0.0,
          0.0
        ]
      },
      "componentId": "open-box",
      "connectivityIntent": "preserve",
      "featureRetentionPolicy": {
        "minimumLodQuota": 16,
        "protected": true
      },
      "massWeight": 0.4508454810495627,
      "minimumMassWeight": 0.32,
      "mobilePolicy": {
        "eligible": true,
        "minimumLod": 512
      },
      "parentAssemblyNode": "source-0-shell-2",
      "semanticRole": "secondary",
      "silhouetteRetentionPolicy": {
        "minimumLodQuota": 16,
        "protected": true
      },
      "surfaceImportance": 1.35,
      "targetId": "merch-tee-thermos-box",
      "targetVersion": "1.0.0",
      "transitionAnchors": [
        {
          "anchorId": "primary-axis",
          "direction": [
            0.0,
            0.0,
            1.0
          ],
          "kind": "primaryAxis",
          "point": [
            0.0,
            0.0,
            0.0
          ]
        },
        {
          "anchorId": "cavity-transport",
          "kind": "transportZone",
          "region": {
            "params": {
              "center": [
                0.0,
                0.0,
                0.1
              ],
              "half": [
                0.34,
                0.34,
                0.18
              ],
              "radius": 0.05
            },
            "provider": "rounded_box"
          }
        },
        {
          "anchorId": "toward-tee",
          "kind": "bridgeZone",
          "point": [
            -0.46,
            0.3,
            -0.1
          ],
          "radius": 0.24
        }
      ]
    }
  ],
  "compositionMode": "SINGLE",
  "displayName": "SINGLE / Merch",
  "focusCompetencyId": "merch",
  "identityPolicy": {
    "mapping": "canonical-master-stratified",
    "size": 16384,
    "spaceVersion": "ps03m3-identity-v1"
  },
  "lodPolicy": {
    "levels": [
      512,
      1024,
      2048,
      4096,
      8192,
      12288,
      16384
    ],
    "nested": true,
    "priority": "protected-zones-weighted-round-robin"
  },
  "normalizationPolicy": {
    "mode": "preserve-v0",
    "targetVolume": 4.185075142010032,
    "tolerance": 0.01
  },
  "provenance": {
    "approvalStatus": "human-approved-source",
    "baselineContentHash": "de23b15eecf3ecb9e5a885bd67c2035375fca80060c675806bffe2d9f1deca53",
    "baselineDefinitionHash": "26a45a70e2950f5dce743993236377d944c16091736c2f6c1978893a9173077f",
    "baselineStateId": "single-merch",
    "builder": "ps03m31-presentation-builder-v1",
    "sourceDefinitionHashes": {
      "merch-tee-thermos-box": "5ebb20072989ac39e1c6aac6bec50cae62201c067d8d0e73850f55205b3258c9"
    },
    "stage": "PS-03.M3.1"
  },
  "reservePolicy": {
    "depthRange": [
      0.16,
      0.32
    ],
    "emergenceOrder": "lod-priority",
    "mode": "canonical-subsurface-pack"
  },
  "schemaVersion": "1.0.0",
  "sourceTargets": [
    {
      "definitionHash": "5ebb20072989ac39e1c6aac6bec50cae62201c067d8d0e73850f55205b3258c9",
      "targetId": "merch-tee-thermos-box",
      "targetVersion": "1.0.0"
    }
  ],
  "stateId": "single-merch",
  "stateRole": "single",
  "stateVersion": "3.1.0",
  "surfaceEnvelopePolicy": {
    "contactCull": false,
    "maximumAreaRatio": 2.645,
    "preferredAreaRatio": 2.6
  },
  "transitionAffordances": {
    "allowedInternalTransport": true,
    "inheritTargetAnchors": true,
    "primaryAxis": [
      1.0,
      0.0,
      0.0
    ]
  },
  "validationPolicy": {
    "allowDeclaredFusionOverlap": false,
    "surfaceEnvelope": 2.645,
    "volumeTolerance": 0.01
  }
}
