{
  "assemblyProfile": {
    "componentSelection": "full-focus-primary-echo",
    "exposurePolicy": "protected-centroid-occlusion-v1",
    "placement": "compact-overlap",
    "profileVersion": "1.0.0"
  },
  "canonicalBounds": {
    "max": [
      1.3160962399975824,
      2.1597170991936103,
      0.5312536471063529
    ],
    "min": [
      -1.9799541877908156,
      -1.2449045954738216,
      -1.029689823124829
    ],
    "size": [
      3.2960504277883977,
      3.4046216946674317,
      1.560943470231182
    ]
  },
  "canonicalCoordinateSystem": {
    "forwardAxis": "+X",
    "handedness": "right",
    "originPolicy": "canonicalBoundsCenter",
    "rightAxis": "-Y",
    "units": "photonic-skin authoring units (V0 sphere radius = 1.0)",
    "upAxis": "+Z"
  },
  "canonicalTransform": {
    "rotateEulerDegrees": [
      0.0,
      0.0,
      0.0
    ],
    "scale": 1.0,
    "translate": [
      0.0,
      0.0,
      0.0
    ]
  },
  "competencyIds": [
    "content",
    "digital",
    "merch"
  ],
  "componentSelections": [
    {
      "assemblyRole": "primary",
      "canonicalTransform": {
        "rotateEulerDegrees": [
          0.0,
          0.0,
          0.0
        ],
        "scale": 0.8193212706006459,
        "translate": [
          0.0,
          0.0,
          0.0
        ]
      },
      "componentId": "book-body",
      "connectivityIntent": "fuse",
      "featureRetentionPolicy": {
        "minimumLodQuota": 16,
        "protected": true
      },
      "massWeight": 0.55,
      "minimumMassWeight": 0.03889380417022832,
      "mobilePolicy": {
        "eligible": true,
        "minimumLod": 512
      },
      "parentAssemblyNode": "source-0-shell-0",
      "semanticRole": "primary",
      "silhouetteRetentionPolicy": {
        "minimumLodQuota": 16,
        "protected": true
      },
      "surfaceImportance": 1.35,
      "targetId": "content-open-book",
      "targetVersion": "1.0.0",
      "transitionAnchors": [
        {
          "anchorId": "primary-axis",
          "direction": [
            0.0,
            1.0,
            0.0
          ],
          "kind": "primaryAxis",
          "notes": "Spine direction is the lead axis of the form.",
          "point": [
            0.0,
            0.0,
            0.0
          ]
        },
        {
          "anchorId": "spine-protected",
          "kind": "protectedZone",
          "notes": "The hinge must stay solid: it carries the whole read of the form.",
          "region": {
            "params": {
              "a": [
                0.0,
                -0.86,
                -0.05
              ],
              "b": [
                0.0,
                0.86,
                -0.05
              ],
              "radius": 0.26
            },
            "provider": "capsule"
          }
        },
        {
          "anchorId": "spine-transport",
          "kind": "transportZone",
          "region": {
            "params": {
              "a": [
                0.0,
                -0.8,
                -0.05
              ],
              "b": [
                0.0,
                0.8,
                -0.05
              ],
              "radius": 0.16
            },
            "provider": "capsule"
          }
        }
      ]
    },
    {
      "assemblyRole": "echo",
      "canonicalTransform": {
        "rotateEulerDegrees": [
          0.0,
          0.0,
          234.06422739549456
        ],
        "scale": 0.7482519997989566,
        "translate": [
          -0.4493698365462385,
          0.3257172853908843,
          -0.19924009639195767
        ]
      },
      "componentId": "laptop-base",
      "connectivityIntent": "fuse",
      "featureRetentionPolicy": {
        "minimumLodQuota": 16,
        "protected": true
      },
      "massWeight": 0.22499999999999995,
      "minimumMassWeight": 0.22499999999999995,
      "mobilePolicy": {
        "eligible": false,
        "minimumLod": 512
      },
      "parentAssemblyNode": "source-1-shell-16",
      "semanticRole": "primary",
      "silhouetteRetentionPolicy": {
        "minimumLodQuota": 16,
        "protected": true
      },
      "surfaceImportance": 1.0,
      "targetId": "digital-laptop-phone",
      "targetVersion": "1.0.0",
      "transitionAnchors": [
        {
          "anchorId": "primary-axis",
          "direction": [
            0.0,
            1.0,
            0.0
          ],
          "kind": "primaryAxis",
          "point": [
            0.0,
            0.0,
            0.0
          ]
        },
        {
          "anchorId": "hinge-protected",
          "kind": "protectedZone",
          "notes": "The hinge line carries the whole open-laptop read.",
          "region": {
            "params": {
              "a": [
                -0.74,
                0.55,
                0.09
              ],
              "b": [
                0.74,
                0.55,
                0.09
              ],
              "radius": 0.18
            },
            "provider": "capsule"
          }
        },
        {
          "anchorId": "toward-phone",
          "kind": "bridgeZone",
          "point": [
            0.8,
            -0.16,
            0.0
          ],
          "radius": 0.24
        }
      ]
    },
    {
      "assemblyRole": "echo",
      "canonicalTransform": {
        "rotateEulerDegrees": [
          0.0,
          0.0,
          354.0642273954945
        ],
        "scale": 0.8132203646458617,
        "translate": [
          -0.05739452532709268,
          -0.5520243368389456,
          0.21996013100821268
        ]
      },
      "componentId": "tee",
      "connectivityIntent": "fuse",
      "featureRetentionPolicy": {
        "minimumLodQuota": 16,
        "protected": true
      },
      "massWeight": 0.22499999999999995,
      "minimumMassWeight": 0.22499999999999995,
      "mobilePolicy": {
        "eligible": false,
        "minimumLod": 512
      },
      "parentAssemblyNode": "source-2-shell-32",
      "semanticRole": "primary",
      "silhouetteRetentionPolicy": {
        "minimumLodQuota": 16,
        "protected": true
      },
      "surfaceImportance": 1.0,
      "targetId": "merch-tee-thermos-box",
      "targetVersion": "1.0.0",
      "transitionAnchors": [
        {
          "anchorId": "primary-axis",
          "direction": [
            0.0,
            1.0,
            0.0
          ],
          "kind": "primaryAxis",
          "point": [
            0.0,
            0.0,
            0.0
          ]
        },
        {
          "anchorId": "toward-thermos",
          "kind": "bridgeZone",
          "point": [
            0.44,
            0.34,
            0.0
          ],
          "radius": 0.24
        }
      ]
    }
  ],
  "compositionMode": "FOCUS",
  "displayName": "Complex Focus Content Digital Merch Focus Content",
  "focusCompetencyId": "content",
  "identityPolicy": {
    "mapping": "canonical-master-stratified",
    "size": 16384,
    "spaceVersion": "ps03m3-identity-v1"
  },
  "lodPolicy": {
    "levels": [
      512,
      1024,
      2048,
      4096,
      8192,
      12288,
      16384
    ],
    "nested": true,
    "priority": "protected-zones-weighted-round-robin"
  },
  "normalizationPolicy": {
    "mode": "preserve-v0",
    "targetVolume": 4.185075142010032,
    "tolerance": 0.01
  },
  "provenance": {
    "approvalStatus": "requires-human-approval",
    "builder": "ps03m3-builder-v1",
    "sourceDefinitionHashes": {
      "content-open-book": "5f19dc0562c2845b9864e862a7a8482309bd95c0b7169d63f0442b3c991af6e9",
      "digital-laptop-phone": "0340464f4076842396fbf90619a94a2402f7a4480b1c640be54efa1c43bc92c1",
      "merch-tee-thermos-box": "5ebb20072989ac39e1c6aac6bec50cae62201c067d8d0e73850f55205b3258c9"
    },
    "stage": "PS-03.M3"
  },
  "reservePolicy": {
    "depthRange": [
      0.16,
      0.32
    ],
    "emergenceOrder": "lod-priority",
    "mode": "canonical-subsurface-pack"
  },
  "schemaVersion": "1.0.0",
  "sourceTargets": [
    {
      "definitionHash": "5f19dc0562c2845b9864e862a7a8482309bd95c0b7169d63f0442b3c991af6e9",
      "targetId": "content-open-book",
      "targetVersion": "1.0.0"
    },
    {
      "definitionHash": "0340464f4076842396fbf90619a94a2402f7a4480b1c640be54efa1c43bc92c1",
      "targetId": "digital-laptop-phone",
      "targetVersion": "1.0.0"
    },
    {
      "definitionHash": "5ebb20072989ac39e1c6aac6bec50cae62201c067d8d0e73850f55205b3258c9",
      "targetId": "merch-tee-thermos-box",
      "targetVersion": "1.0.0"
    }
  ],
  "stateId": "complex-focus-content-digital-merch-focus-content",
  "stateRole": "complex",
  "stateVersion": "1.0.0",
  "surfaceEnvelopePolicy": {
    "contactCull": true,
    "maximumAreaRatio": 2.645,
    "preferredAreaRatio": 2.6
  },
  "transitionAffordances": {
    "allowedInternalTransport": true,
    "inheritTargetAnchors": true,
    "primaryAxis": [
      1.0,
      0.0,
      0.0
    ]
  },
  "validationPolicy": {
    "allowDeclaredFusionOverlap": true,
    "surfaceEnvelope": 2.645,
    "volumeTolerance": 0.01
  }
}
