{
  "assemblyProfile": {
    "componentSelection": "full-focus-primary-echo",
    "exposurePolicy": "protected-centroid-occlusion-v1",
    "placement": "compact-overlap",
    "profileVersion": "1.0.0"
  },
  "canonicalBounds": {
    "max": [
      1.631136945047527,
      1.1264702872444843,
      0.8028916826525725
    ],
    "min": [
      -1.631136945047527,
      -2.578722251256323,
      -1.4519484681595125
    ],
    "size": [
      3.262273890095054,
      3.705192538500807,
      2.254840150812085
    ]
  },
  "canonicalCoordinateSystem": {
    "forwardAxis": "+X",
    "handedness": "right",
    "originPolicy": "canonicalBoundsCenter",
    "rightAxis": "-Y",
    "units": "photonic-skin authoring units (V0 sphere radius = 1.0)",
    "upAxis": "+Z"
  },
  "canonicalTransform": {
    "rotateEulerDegrees": [
      0.0,
      0.0,
      0.0
    ],
    "scale": 1.0,
    "translate": [
      0.0,
      0.0,
      0.0
    ]
  },
  "competencyIds": [
    "design",
    "event",
    "video"
  ],
  "componentSelections": [
    {
      "assemblyRole": "primary",
      "canonicalTransform": {
        "rotateEulerDegrees": [
          0.0,
          0.0,
          0.0
        ],
        "scale": 0.8707514766019345,
        "translate": [
          0.0,
          0.0,
          0.0
        ]
      },
      "componentId": "palette-board",
      "connectivityIntent": "fuse",
      "featureRetentionPolicy": {
        "minimumLodQuota": 16,
        "protected": true
      },
      "massWeight": 0.55,
      "minimumMassWeight": 0.55,
      "mobilePolicy": {
        "eligible": true,
        "minimumLod": 512
      },
      "parentAssemblyNode": "source-0-shell-0",
      "semanticRole": "primary",
      "silhouetteRetentionPolicy": {
        "minimumLodQuota": 16,
        "protected": true
      },
      "surfaceImportance": 1.35,
      "targetId": "design-palette-brushes",
      "targetVersion": "1.0.0",
      "transitionAnchors": [
        {
          "anchorId": "primary-axis",
          "direction": [
            1.0,
            0.0,
            0.0
          ],
          "kind": "primaryAxis",
          "point": [
            0.0,
            0.0,
            0.0
          ]
        },
        {
          "anchorId": "hole-protected",
          "kind": "protectedZone",
          "notes": "A compiler must not close the hole while the board still reads as a palette.",
          "region": {
            "params": {
              "a": [
                0.6,
                -0.28,
                -0.6
              ],
              "b": [
                0.6,
                -0.28,
                0.6
              ],
              "radius": 0.3
            },
            "provider": "capsule"
          }
        },
        {
          "anchorId": "toward-brushes",
          "kind": "bridgeZone",
          "point": [
            -0.2,
            0.52,
            0.16
          ],
          "radius": 0.26
        }
      ]
    },
    {
      "assemblyRole": "echo",
      "canonicalTransform": {
        "rotateEulerDegrees": [
          0.0,
          0.0,
          234.06422739549456
        ],
        "scale": 1.6950664812451353,
        "translate": [
          -0.4493698365462385,
          0.3257172853908843,
          -0.19924009639195767
        ]
      },
      "componentId": "figure-right",
      "connectivityIntent": "fuse",
      "featureRetentionPolicy": {
        "minimumLodQuota": 16,
        "protected": true
      },
      "massWeight": 0.22499999999999998,
      "minimumMassWeight": 0.02,
      "mobilePolicy": {
        "eligible": false,
        "minimumLod": 512
      },
      "parentAssemblyNode": "source-1-shell-16",
      "semanticRole": "figure",
      "silhouetteRetentionPolicy": {
        "minimumLodQuota": 16,
        "protected": true
      },
      "surfaceImportance": 1.0,
      "targetId": "event-stage-figures",
      "targetVersion": "1.0.0",
      "transitionAnchors": [
        {
          "anchorId": "primary-axis",
          "direction": [
            0.0,
            0.0,
            1.0
          ],
          "kind": "primaryAxis",
          "point": [
            0.0,
            0.0,
            0.0
          ]
        },
        {
          "anchorId": "foot-neck",
          "direction": [
            0.0,
            0.0,
            1.0
          ],
          "kind": "splitNeck",
          "point": [
            0.0,
            0.0,
            -0.28
          ],
          "radius": 0.16
        }
      ]
    },
    {
      "assemblyRole": "echo",
      "canonicalTransform": {
        "rotateEulerDegrees": [
          0.0,
          0.0,
          354.0642273954945
        ],
        "scale": 0.6890157942891775,
        "translate": [
          -0.05739452532709268,
          -0.5520243368389456,
          0.21996013100821268
        ]
      },
      "componentId": "camera",
      "connectivityIntent": "fuse",
      "featureRetentionPolicy": {
        "minimumLodQuota": 16,
        "protected": true
      },
      "massWeight": 0.22499999999999995,
      "minimumMassWeight": 0.22499999999999995,
      "mobilePolicy": {
        "eligible": false,
        "minimumLod": 512
      },
      "parentAssemblyNode": "source-2-shell-32",
      "semanticRole": "primary",
      "silhouetteRetentionPolicy": {
        "minimumLodQuota": 16,
        "protected": true
      },
      "surfaceImportance": 1.0,
      "targetId": "video-camera-clapperboard",
      "targetVersion": "1.0.0",
      "transitionAnchors": [
        {
          "anchorId": "primary-axis",
          "direction": [
            1.0,
            0.0,
            0.0
          ],
          "kind": "primaryAxis",
          "point": [
            0.0,
            0.0,
            0.0
          ]
        },
        {
          "anchorId": "lens-protected",
          "kind": "protectedZone",
          "region": {
            "params": {
              "a": [
                0.46,
                0.0,
                0.03
              ],
              "b": [
                0.9,
                0.0,
                0.03
              ],
              "radius": 0.28
            },
            "provider": "capsule"
          }
        },
        {
          "anchorId": "toward-slate",
          "kind": "bridgeZone",
          "point": [
            0.3,
            -0.34,
            -0.24
          ],
          "radius": 0.26
        }
      ]
    }
  ],
  "compositionMode": "FOCUS",
  "displayName": "Complex Focus Design Event Video Focus Design",
  "focusCompetencyId": "design",
  "identityPolicy": {
    "mapping": "canonical-master-stratified",
    "size": 16384,
    "spaceVersion": "ps03m3-identity-v1"
  },
  "lodPolicy": {
    "levels": [
      512,
      1024,
      2048,
      4096,
      8192,
      12288,
      16384
    ],
    "nested": true,
    "priority": "protected-zones-weighted-round-robin"
  },
  "normalizationPolicy": {
    "mode": "preserve-v0",
    "targetVolume": 4.185075142010032,
    "tolerance": 0.01
  },
  "provenance": {
    "approvalStatus": "requires-human-approval",
    "builder": "ps03m3-builder-v1",
    "sourceDefinitionHashes": {
      "design-palette-brushes": "d16425cb8c109ae13777bd6464df11a3012fc0fb9121fd1b6c3f157d805a33db",
      "event-stage-figures": "789fc3cb34eb829b1179eab7a1b2f054e187be007f7749b7fbeccc6886453210",
      "video-camera-clapperboard": "435b9d3030fff9f6a2c65ec3b2eb7cee570966873f85bab0f83940732045c762"
    },
    "stage": "PS-03.M3"
  },
  "reservePolicy": {
    "depthRange": [
      0.16,
      0.32
    ],
    "emergenceOrder": "lod-priority",
    "mode": "canonical-subsurface-pack"
  },
  "schemaVersion": "1.0.0",
  "sourceTargets": [
    {
      "definitionHash": "d16425cb8c109ae13777bd6464df11a3012fc0fb9121fd1b6c3f157d805a33db",
      "targetId": "design-palette-brushes",
      "targetVersion": "1.0.0"
    },
    {
      "definitionHash": "789fc3cb34eb829b1179eab7a1b2f054e187be007f7749b7fbeccc6886453210",
      "targetId": "event-stage-figures",
      "targetVersion": "1.0.0"
    },
    {
      "definitionHash": "435b9d3030fff9f6a2c65ec3b2eb7cee570966873f85bab0f83940732045c762",
      "targetId": "video-camera-clapperboard",
      "targetVersion": "1.0.0"
    }
  ],
  "stateId": "complex-focus-design-event-video-focus-design",
  "stateRole": "complex",
  "stateVersion": "1.0.0",
  "surfaceEnvelopePolicy": {
    "contactCull": true,
    "maximumAreaRatio": 2.645,
    "preferredAreaRatio": 2.6
  },
  "transitionAffordances": {
    "allowedInternalTransport": true,
    "inheritTargetAnchors": true,
    "primaryAxis": [
      1.0,
      0.0,
      0.0
    ]
  },
  "validationPolicy": {
    "allowDeclaredFusionOverlap": true,
    "surfaceEnvelope": 2.645,
    "volumeTolerance": 0.01
  }
}
