{
  "assemblyProfile": {
    "componentSelection": "full-focus-primary-echo",
    "exposurePolicy": "protected-centroid-occlusion-v1",
    "placement": "compact-overlap",
    "profileVersion": "1.0.0"
  },
  "canonicalBounds": {
    "max": [
      0.912203262836672,
      2.0659732216997098,
      0.04464735174833612
    ],
    "min": [
      -2.438308401689904,
      -1.0223093279537938,
      -1.1186822235958804
    ],
    "size": [
      3.350511664526576,
      3.0882825496535036,
      1.1633295753442165
    ]
  },
  "canonicalCoordinateSystem": {
    "forwardAxis": "+X",
    "handedness": "right",
    "originPolicy": "canonicalBoundsCenter",
    "rightAxis": "-Y",
    "units": "photonic-skin authoring units (V0 sphere radius = 1.0)",
    "upAxis": "+Z"
  },
  "canonicalTransform": {
    "rotateEulerDegrees": [
      0.0,
      0.0,
      0.0
    ],
    "scale": 1.0,
    "translate": [
      0.0,
      0.0,
      0.0
    ]
  },
  "competencyIds": [
    "digital",
    "games",
    "merch"
  ],
  "componentSelections": [
    {
      "assemblyRole": "primary",
      "canonicalTransform": {
        "rotateEulerDegrees": [
          0.0,
          0.0,
          0.0
        ],
        "scale": 1.0079553090327102,
        "translate": [
          0.0,
          0.0,
          0.0
        ]
      },
      "componentId": "laptop-base",
      "connectivityIntent": "fuse",
      "featureRetentionPolicy": {
        "minimumLodQuota": 16,
        "protected": true
      },
      "massWeight": 0.55,
      "minimumMassWeight": 0.38,
      "mobilePolicy": {
        "eligible": true,
        "minimumLod": 512
      },
      "parentAssemblyNode": "source-0-shell-0",
      "semanticRole": "primary",
      "silhouetteRetentionPolicy": {
        "minimumLodQuota": 16,
        "protected": true
      },
      "surfaceImportance": 1.35,
      "targetId": "digital-laptop-phone",
      "targetVersion": "1.0.0",
      "transitionAnchors": [
        {
          "anchorId": "primary-axis",
          "direction": [
            0.0,
            1.0,
            0.0
          ],
          "kind": "primaryAxis",
          "point": [
            0.0,
            0.0,
            0.0
          ]
        },
        {
          "anchorId": "hinge-protected",
          "kind": "protectedZone",
          "notes": "The hinge line carries the whole open-laptop read.",
          "region": {
            "params": {
              "a": [
                -0.74,
                0.55,
                0.09
              ],
              "b": [
                0.74,
                0.55,
                0.09
              ],
              "radius": 0.18
            },
            "provider": "capsule"
          }
        },
        {
          "anchorId": "toward-phone",
          "kind": "bridgeZone",
          "point": [
            0.8,
            -0.16,
            0.0
          ],
          "radius": 0.24
        }
      ]
    },
    {
      "assemblyRole": "echo",
      "canonicalTransform": {
        "rotateEulerDegrees": [
          0.0,
          0.0,
          234.06422739549456
        ],
        "scale": 0.7026816453228318,
        "translate": [
          -0.4493698365462385,
          0.3257172853908843,
          -0.19924009639195767
        ]
      },
      "componentId": "gamepad",
      "connectivityIntent": "fuse",
      "featureRetentionPolicy": {
        "minimumLodQuota": 16,
        "protected": true
      },
      "massWeight": 0.22499999999999998,
      "minimumMassWeight": 0.22499999999999998,
      "mobilePolicy": {
        "eligible": false,
        "minimumLod": 512
      },
      "parentAssemblyNode": "source-1-shell-16",
      "semanticRole": "primary",
      "silhouetteRetentionPolicy": {
        "minimumLodQuota": 16,
        "protected": true
      },
      "surfaceImportance": 1.0,
      "targetId": "games-gamepad-queen",
      "targetVersion": "1.0.0",
      "transitionAnchors": [
        {
          "anchorId": "primary-axis",
          "direction": [
            0.0,
            1.0,
            0.0
          ],
          "kind": "primaryAxis",
          "point": [
            0.0,
            0.0,
            0.0
          ]
        },
        {
          "anchorId": "toward-queen",
          "kind": "bridgeZone",
          "notes": "Where a transition compiler may grow matter toward the second component.",
          "point": [
            0.42,
            0.0,
            0.05
          ],
          "radius": 0.3
        },
        {
          "anchorId": "face-protected",
          "kind": "protectedZone",
          "region": {
            "params": {
              "center": [
                0.0,
                0.05,
                0.2
              ],
              "half": [
                0.5,
                0.3,
                0.1
              ],
              "radius": 0.08
            },
            "provider": "rounded_box"
          }
        }
      ]
    },
    {
      "assemblyRole": "echo",
      "canonicalTransform": {
        "rotateEulerDegrees": [
          0.0,
          0.0,
          354.0642273954945
        ],
        "scale": 0.8132203646458617,
        "translate": [
          -0.05739452532709268,
          -0.5520243368389456,
          0.21996013100821268
        ]
      },
      "componentId": "tee",
      "connectivityIntent": "fuse",
      "featureRetentionPolicy": {
        "minimumLodQuota": 16,
        "protected": true
      },
      "massWeight": 0.22499999999999998,
      "minimumMassWeight": 0.22499999999999998,
      "mobilePolicy": {
        "eligible": false,
        "minimumLod": 512
      },
      "parentAssemblyNode": "source-2-shell-32",
      "semanticRole": "primary",
      "silhouetteRetentionPolicy": {
        "minimumLodQuota": 16,
        "protected": true
      },
      "surfaceImportance": 1.0,
      "targetId": "merch-tee-thermos-box",
      "targetVersion": "1.0.0",
      "transitionAnchors": [
        {
          "anchorId": "primary-axis",
          "direction": [
            0.0,
            1.0,
            0.0
          ],
          "kind": "primaryAxis",
          "point": [
            0.0,
            0.0,
            0.0
          ]
        },
        {
          "anchorId": "toward-thermos",
          "kind": "bridgeZone",
          "point": [
            0.44,
            0.34,
            0.0
          ],
          "radius": 0.24
        }
      ]
    }
  ],
  "compositionMode": "FOCUS",
  "displayName": "Complex Focus Digital Games Merch Focus Digital",
  "focusCompetencyId": "digital",
  "identityPolicy": {
    "mapping": "canonical-master-stratified",
    "size": 16384,
    "spaceVersion": "ps03m3-identity-v1"
  },
  "lodPolicy": {
    "levels": [
      512,
      1024,
      2048,
      4096,
      8192,
      12288,
      16384
    ],
    "nested": true,
    "priority": "protected-zones-weighted-round-robin"
  },
  "normalizationPolicy": {
    "mode": "preserve-v0",
    "targetVolume": 4.185075142010032,
    "tolerance": 0.01
  },
  "provenance": {
    "approvalStatus": "requires-human-approval",
    "builder": "ps03m3-builder-v1",
    "sourceDefinitionHashes": {
      "digital-laptop-phone": "0340464f4076842396fbf90619a94a2402f7a4480b1c640be54efa1c43bc92c1",
      "games-gamepad-queen": "0596ae4166b8ace7ea66f87367ca24daff00bc0f0134f07056f4d0dfe55f2b4b",
      "merch-tee-thermos-box": "5ebb20072989ac39e1c6aac6bec50cae62201c067d8d0e73850f55205b3258c9"
    },
    "stage": "PS-03.M3"
  },
  "reservePolicy": {
    "depthRange": [
      0.16,
      0.32
    ],
    "emergenceOrder": "lod-priority",
    "mode": "canonical-subsurface-pack"
  },
  "schemaVersion": "1.0.0",
  "sourceTargets": [
    {
      "definitionHash": "0340464f4076842396fbf90619a94a2402f7a4480b1c640be54efa1c43bc92c1",
      "targetId": "digital-laptop-phone",
      "targetVersion": "1.0.0"
    },
    {
      "definitionHash": "0596ae4166b8ace7ea66f87367ca24daff00bc0f0134f07056f4d0dfe55f2b4b",
      "targetId": "games-gamepad-queen",
      "targetVersion": "1.0.0"
    },
    {
      "definitionHash": "5ebb20072989ac39e1c6aac6bec50cae62201c067d8d0e73850f55205b3258c9",
      "targetId": "merch-tee-thermos-box",
      "targetVersion": "1.0.0"
    }
  ],
  "stateId": "complex-focus-digital-games-merch-focus-digital",
  "stateRole": "complex",
  "stateVersion": "1.0.0",
  "surfaceEnvelopePolicy": {
    "contactCull": true,
    "maximumAreaRatio": 2.645,
    "preferredAreaRatio": 2.6
  },
  "transitionAffordances": {
    "allowedInternalTransport": true,
    "inheritTargetAnchors": true,
    "primaryAxis": [
      1.0,
      0.0,
      0.0
    ]
  },
  "validationPolicy": {
    "allowDeclaredFusionOverlap": true,
    "surfaceEnvelope": 2.645,
    "volumeTolerance": 0.01
  }
}
